{
  "type": "CoverageCollection",
  "domainType": "Grid",
  "parameters": {
    "VAP": {
      "type": "Parameter",
      "description": {
        "en": "Start of Vegetation Active Period",
        "es": "Inicio del Periodo Activo de Vegetaci\u00f3n",
        "zh": "\u690d\u88ab\u6d3b\u8dc3\u671f\u8d77\u59cb",
        "ro": "\u00cenceputul Perioadei Active a Vegeta\u021biei"
      },
      "unit": {
        "label": {
          "en": "Day of Year"
        },
        "symbol": {
          "value": "d"
        }
      },
      "observedProperty": {
        "id": "https://w3id.org/ogc/hosted/ebv-phenology/StartOfVAP",
        "label": {
          "en": "Start of VAP",
          "es": "Inicio del PAV",
          "zh": "VAP\u8d77\u59cb",
          "ro": "\u00cenceputul VAP"
        }
      }
    }
  },
  "parameterGroups": [
    {
      "type": "ParameterGroup",
      "label": {
        "en": "Phenology by forest type",
        "es": "Fenolog\u00eda por tipo de bosque"
      },
      "observedProperty": {
        "id": "https://w3id.org/ogc/hosted/ebv-phenology/EcosystemPhenology",
        "label": {
          "en": "Ecosystem Phenology",
          "es": "Fenolog\u00eda del Ecosistema"
        }
      },
      "members": [
        "VAP_coniferous",
        "VAP_deciduous"
      ]
    }
  ],
  "coverages": [
    {
      "type": "Coverage",
      "domain": {
        "type": "Domain",
        "domainType": "Grid",
        "axes": {
          "x": {
            "start": 14.1,
            "stop": 35.23,
            "num": 320
          },
          "y": {
            "start": 57.75,
            "stop": 71.17,
            "num": 200
          },
          "t": {
            "values": [
              "2001",
              "2002",
              "2003",
              "2004",
              "2005",
              "2006",
              "2007",
              "2008",
              "2009",
              "2010",
              "2011",
              "2012",
              "2013",
              "2014",
              "2015",
              "2016",
              "2017",
              "2018"
            ]
          }
        },
        "referencing": [
          {
            "coordinates": [
              "x",
              "y"
            ],
            "system": {
              "type": "GeographicCRS",
              "id": "http://www.opengis.net/def/crs/OGC/1.3/CRS84"
            }
          },
          {
            "coordinates": [
              "t"
            ],
            "system": {
              "type": "TemporalRS",
              "calendar": "Gregorian"
            }
          }
        ]
      },
      "ranges": {
        "VAP": {
          "type": "NdArray",
          "dataType": "integer",
          "axisNames": [
            "t",
            "y",
            "x"
          ],
          "shape": [
            18,
            200,
            320
          ]
        }
      }
    },
    {
      "type": "Coverage",
      "domain": {
        "type": "Domain",
        "domainType": "Grid",
        "axes": {
          "x": {
            "start": 14.1,
            "stop": 35.23,
            "num": 320
          },
          "y": {
            "start": 57.75,
            "stop": 71.17,
            "num": 200
          },
          "t": {
            "values": [
              "2001",
              "2002",
              "2003",
              "2004",
              "2005",
              "2006",
              "2007",
              "2008",
              "2009",
              "2010",
              "2011",
              "2012",
              "2013",
              "2014",
              "2015",
              "2016",
              "2017",
              "2018"
            ]
          }
        },
        "referencing": [
          {
            "coordinates": [
              "x",
              "y"
            ],
            "system": {
              "type": "GeographicCRS",
              "id": "http://www.opengis.net/def/crs/OGC/1.3/CRS84"
            }
          },
          {
            "coordinates": [
              "t"
            ],
            "system": {
              "type": "TemporalRS",
              "calendar": "Gregorian"
            }
          }
        ]
      },
      "ranges": {
        "VAP": {
          "type": "NdArray",
          "dataType": "integer",
          "axisNames": [
            "t",
            "y",
            "x"
          ],
          "shape": [
            18,
            200,
            320
          ]
        }
      }
    }
  ]
}